{
  "package_name": "static_objects_demo",
  "launch_rviz": true,
  "static_objects": [
    {
      "name": "table",
      "pose": [0.6, 0.0, 0.25, 0.0, 0.0, 0.0],
      "box": [0.6, 0.6, 0.5]
    },
    {
      "name": "beaker_post",
      "pose": [0.0, 0.5, 0.15, 0.0, 0.0, 0.0],
      "cylinder": { "radius": 0.05, "length": 0.3 }
    },
    {
      "name": "marker_ball",
      "pose": [-0.4, -0.4, 0.1, 0.0, 0.0, 0.0],
      "sphere": { "radius": 0.1 }
    }
  ],
  "robot_arms": [
    {
      "key": "robot1",
      "model": "ur5",
      "base_coordinates": { "x": "0", "y": "0", "z": "0", "R": "0", "P": "0", "Y": "0" },
      "initial_joints": {
        "shoulder_pan": "0", "shoulder_lift": "-1.57", "elbow": "0",
        "wrist_1": "-1.57", "wrist_2": "0", "wrist_3": "0"
      }
    },
    {
      "key": "robot2",
      "model": "ur3",
      "base_coordinates": { "x": "1.0", "y": "1.0", "z": "0", "R": "0", "P": "0", "Y": "1.5708" },
      "initial_joints": {
        "shoulder_pan": "0", "shoulder_lift": "-1.57", "elbow": "0",
        "wrist_1": "-1.57", "wrist_2": "0", "wrist_3": "0"
      }
    }
  ]
}
